{
  "schema_version": 1,
  "name": "decklink-mxl-input",
  "version": "0.1.0",
  "kind": "input",
  "maturity": "concept",
  "requires_core_api": "^1.0",
  "entrypoint": null,
  "capabilities": ["decklink.receive", "mxl.video.publish", "mxl.audio.publish", "health.publish"],
  "flow_roles": {"reads": [], "publishes": ["source.video", "source.audio"]},
  "health": {"state_path": "/api/v1/state", "liveness_path": "/api/v1/health/live", "readiness_path": "/api/v1/health/ready", "bind_scope": "loopback"},
  "external_dependencies": ["Blackmagic Desktop Video", "DeckLink hardware"],
  "secret_refs": []
}
