{
  "schema_version": 1,
  "name": "program-decklink-output",
  "version": "0.1.0",
  "kind": "output",
  "maturity": "concept",
  "requires_core_api": "^1.0",
  "entrypoint": null,
  "capabilities": ["program.video.read", "program.audio.read", "decklink.send", "health.publish"],
  "flow_roles": {"reads": ["program.video", "program.audio"], "publishes": []},
  "health": {
    "state_path": "/api/v1/state",
    "liveness_path": "/api/v1/health/live",
    "readiness_path": "/api/v1/health/ready",
    "bind_scope": "loopback"
  },
  "external_dependencies": ["Blackmagic Desktop Video", "DeckLink hardware"],
  "secret_refs": []
}
